{
  "meta": { "denomination": "BASE_USDC", "logging": true },
  "caps": { "max_outflow_h1": 25, "max_outflow_d1": 100, "call_rate_cap": "30/hour" },
  "calls": { "allowlist": [ [8453, "0xA0b86991c6218b36c1d19D4a2e9Eb0cE3606eB48", "0xa9059cbb"] ] },
  "approvals": { "quorum": 2, "timelock_hours": 24 },
  "controls": { "pause": { "enabled": true } }
}
