{
  "meta": { "denomination": "BASE_USDC", "logging": true },
  "caps": { "max_outflow_h1": 100, "max_outflow_d1": 500, "call_rate_cap": "60/hour", "anomaly_block": { "enabled": true } },
  "calls": { "allowlist": [[8453, "0x0000000000000000000000000000000000000001", "0xa9059cbb"], [8453, "0x0000000000000000000000000000000000000002", "0x095ea7b3"]] },
  "approvals": { "quorum": 2, "timelock_hours": 24 },
  "controls": { "pause": { "enabled": true } }
}
